{"id":"384b501d","name":"C.Y.O Keycaps","instagram":"https://www.instagram.com/ttylerdurden/","website":"","sculpts":[{"id":"2c7a2015","name":"amBEARssador V3","colorways":[{"name":"9009","img":"https://lh4.googleusercontent.com/qMXl3jzIaP0oHQD4EQ6luUDCWrPqMidckEVEKQfoZxdNcwDF34Dk_ZqANNfULgNgYNnxqbwQBFZH1R-c9Qp1OCLoagG9DQ1P2eSsHo5Yd9BKZI4pkl_xvvGMmtdzTJXYJQ","id":"e86bc98e"},{"name":"Exosphere","img":"https://lh5.googleusercontent.com/ZSDB-ora5xFv-NugCNgmSxfAXlc95fwjEcvyagB9KvaeGyLigvdpS3Lldm8C9UnRX9I0ZkmrNP_NafIE1WEuGivjPQYZoWpzI-8ONvLucgEuazLjH8QxCmbNEEqFFSGjqQ","id":"3fb7c5f6"},{"name":"QoD","img":"https://lh5.googleusercontent.com/HQyQV2YBqOsBxJ4DqftCYqDwi89G1nl0UI3QpZinw9ECeufsqHbjnBDn-avxjJZvRzKgzUSojYqDrWOXtwIPH9A3zOT-RM8f2FZlqBebnBEuoCssyh_LopKk0R1AhtdEUg","id":"d335dfeb"},{"name":"Taro","img":"https://lh3.googleusercontent.com/udHCh8eswaMILkl2hqhhA3y3_gbsSWrzqTm9s6q9xyduRuFA8dpQjDHJ3FjmBg4PGh6tZl9tzhDkzCpM_DMAiz8h5XQyIoVJuHwhbYTGtC-sdkKQiY2HM5qQEnkhNML4BQ","id":"9954f5dd"},{"name":"Greyscale","img":"https://lh3.googleusercontent.com/GCs4h2QB1zFAIlyFAGQubm2mrMudHGO_4A3476TsDDylxCyPNHGT7E3HLBzfsyYZ44F5KrsmTb7h-LpzQvQ7OzFF_vzO1P0Lbse4BwsH6daDHgatkY3eNWZYHDVWu8a1Zg","id":"a684de45"}]},{"id":"29cb6513","name":"Packet Pilot V2","colorways":[{"name":"Exosphere","img":"https://lh3.googleusercontent.com/jQt1C_7dNYJgU-Xu60CRk94Kz8fVxwzwilcP49p_nba8q9BRAeT_T94EpXmsKZ9X3HIIIr9PdlTdVzY1y8_ckKUAc6RjtVM_wVmmW4Da7_7KCR3maKRkgGzlIE29px5GQg","id":"6091eb7a"},{"name":"Greyscale","img":"https://lh5.googleusercontent.com/skAYjYSRthZmtfmDddXGPRdzy2xdC5GCHQLhZPMW-tDvAQ5o2LB1J5PkeBcvk-u3xFleK56qedawMVwvGzRHiiC71oPajHvFhYkpBu5CY3j_gvS17IMnqX-YEN9D-NfCkA","id":"abee471d"},{"name":"A cap named git","img":"https://lh5.googleusercontent.com/7pJEshChO70ycXml9kXdbGV1N9M011_htnyitdKuGL2X7PJ1DSfk1cwC7AapHcUR_VMWUDu7ffrBRr6lu3ZXn0d7DKJwRNHJF8Ch5ThwLZAdeoCwa5Mo-eT3NkMydDdeCg","id":"226b4e58"},{"name":"Taro","img":"https://lh4.googleusercontent.com/rwLoA7NiFhXCmBjI_uZE_pgrTZCefEH8xd-LVnXjmZWBxOWKzrnTR9mo_fNTr5fWI9DfR-USY47NNgWPttNRS6NzVuAF1en3y_5XIJ7Kv4nvahhZFh-BUzaMu4Bm99jhhA","id":"f4da1025"}]},{"id":"5e672e81","name":"Bear Claw","colorways":[{"name":"9009","img":"https://lh6.googleusercontent.com/30rLkeoHJzZvKEft4Vtizg75Ddt5y7Cvvn09707qDzntahkt_OC0jIJiFvc8IR5_KU70h1BBosloKqD24s3B5dS0HIJL2Ml6gwzIA6E9PJ3Vwg8s86zfx3dFQTIL3IRdQw","id":"aa6479ae"},{"name":"Taro","img":"https://lh6.googleusercontent.com/E7vO3MG77rAiH6VkgEX08FeuUeaYPeTQvBA1TUwAES5FZ8-DAMfeC0FVONiRWfrau8emM5C47fm7eUSHrzRtqn8C6sywqj3DSU9BeUngAddca3LC1Qs-ZIo2LehT_vQnKQ","id":"a17f72cc"}]},{"id":"2146742e","name":"Blanks","colorways":[{"name":"Taro","img":"https://lh6.googleusercontent.com/byhTxJ1vooOcL4qMLsIUHf95NFnUzgzz4PhF9kGNGCf0_rm7JapdSGovIkFtzsKAVE4s5PmWaAGJRk3i9-sAbINnviK4CFEgNrABPZuIzRjt2XEhnmZxyAMz1vU9NTV-Wg","id":"e4f20e5e"},{"name":"QoD","img":"https://lh6.googleusercontent.com/2-SiqzdUy7gGDWErXj_lhqdDZST4ZBNftPD9xBDCY2osPdGE3uLc-PX33N7FVbFMNmua8y58Hnw-yImuFm01_K2wRaBtKXCR_3FfbpL6-0p2kUOHAHGIOpPSKDPPEUIwDw","id":"830cf491"},{"name":"9009","img":"https://lh3.googleusercontent.com/wCnaXGCI88iGi836IZgswJR_RwTdbolFD18dGyBBbTvyGlhOUO8QtP2KnHAH_DJ4-LjNxODWb1y4vAOsQvCMynRepwt-tltspvX5Vk_NEcHCXDkwExkMpTuRndiiMuSCQQ","id":"ec9481a9"}]}]}